{
  "artifact": "docs-index.json",
  "artifact_schema_version": "1.0.0",
  "scope": {
    "surface": "hand-authored published docs pages included in mkdocs nav",
    "excludes": [
      "generated markdown pages",
      "built site output",
      "repo-local non-doc markdown",
      "full-text content extraction"
    ]
  },
  "pages": [
    {
      "title": "ComfyUI Knowledge Base",
      "path": "index.md",
      "nav_section": "Home",
      "audience": null,
      "evidence": "Source-backed from pinned snapshots",
      "summary": "This documentation section covers ComfyUI development topics including API endpoints, extension hooks, custom node authoring, and extension architecture. It is a source-backed, version-pinned reference, not the official ComfyUI documentation. See [docs.comfy.org](https://docs.comfy.org/) for official docs."
    },
    {
      "title": "Start Here: Custom Node Author",
      "path": "start-here/author.md",
      "nav_section": "Start Here",
      "audience": "consumer",
      "evidence": "Operational guidance",
      "summary": null
    },
    {
      "title": "Start Here: Extension Developer",
      "path": "start-here/extension-developer.md",
      "nav_section": "Start Here",
      "audience": "consumer",
      "evidence": "Source-backed from pinned snapshots",
      "summary": null
    },
    {
      "title": "Start Here: Service Integration",
      "path": "start-here/service-integration.md",
      "nav_section": "Start Here",
      "audience": "consumer",
      "evidence": "Source-backed from pinned snapshots",
      "summary": null
    },
    {
      "title": "Start Here: Docs Contributor",
      "path": "start-here/docs-contributor.md",
      "nav_section": "Start Here",
      "audience": "contributor",
      "evidence": "Operational guidance",
      "summary": null
    },
    {
      "title": "Start Here: Tooling Builder",
      "path": "start-here/tooling-builder.md",
      "nav_section": "Start Here",
      "audience": "consumer",
      "evidence": "Operational guidance",
      "summary": null
    },
    {
      "title": "What's New",
      "path": "whats-new/index.md",
      "nav_section": "Orientation / What's New",
      "audience": null,
      "evidence": "Operational guidance",
      "summary": "This page highlights meaningful repo-visible changes that affect how readers use the docs or published artifacts. It is intentionally selective and does not backfill the full project history."
    },
    {
      "title": "Glossary",
      "path": "reference/glossary.md",
      "nav_section": "Orientation / Glossary",
      "audience": null,
      "evidence": "Operational guidance",
      "summary": "This glossary defines repeated repository and artifact terms that appear across the docs. It is an orientation aid, not a tutorial or a second reference set."
    },
    {
      "title": "Troubleshooting",
      "path": "troubleshooting/index.md",
      "nav_section": "Orientation / Troubleshooting",
      "audience": null,
      "evidence": "Operational guidance",
      "summary": "This section routes readers through recurring confusion points already reflected in the repo's current docs. It is not a general support manual or a full FAQ."
    },
    {
      "title": "API Integration Troubleshooting",
      "path": "troubleshooting/api-integration.md",
      "nav_section": "Orientation / Troubleshooting",
      "audience": null,
      "evidence": "Official docs-backed from docs.comfy.org; Source-backed from pinned snapshots",
      "summary": "This page covers bounded integration confusion that already appears in the API, start-here, and known-limitations docs. It routes you to the right surface instead of restating the full API reference."
    },
    {
      "title": "Custom Node and Extension Boundaries",
      "path": "troubleshooting/custom-node-and-extension-boundaries.md",
      "nav_section": "Orientation / Troubleshooting",
      "audience": null,
      "evidence": "Official docs-backed from docs.comfy.org; Source-backed from pinned snapshots",
      "summary": "This page routes readers who are mixing together server-side nodes, frontend extensions, and distribution assumptions. It stays at the boundary level and points onward to the deeper authoring pages."
    },
    {
      "title": "Docs Authoring and Site Build Troubleshooting",
      "path": "troubleshooting/docs-authoring-and-site-build.md",
      "nav_section": "Orientation / Troubleshooting",
      "audience": null,
      "evidence": "Operational guidance",
      "summary": "This page covers repo-local doc authoring confusion: what kind of file you are editing, when to start from a template or helper, and which minimum checks must pass before you call a doc change done."
    },
    {
      "title": "Known Limitations",
      "path": "known-limitations/index.md",
      "nav_section": "Orientation / Known Limitations",
      "audience": null,
      "evidence": "Official docs-backed from docs.comfy.org; Source-backed from pinned snapshots; Operational guidance for repo-local publication boundaries",
      "summary": "This page is intentionally small. It only keeps limitations that can be verified against the repo's pinned ComfyUI snapshots or official docs."
    },
    {
      "title": "API Section Guide",
      "path": "api/index.md",
      "nav_section": "API Reference / API Section Guide",
      "audience": null,
      "evidence": "Operational guidance",
      "summary": "This hub routes readers through the API section. Use it to choose the first API page to read, not as a replacement for the route reference."
    },
    {
      "title": "API Endpoints",
      "path": "api/endpoints.md",
      "nav_section": "API Reference",
      "audience": null,
      "evidence": "Source-backed from pinned snapshots",
      "summary": "ComfyUI declares its HTTP and WebSocket surface directly in `server.py` using `aiohttp` route decorators. The current file defines 25 primary routes on `self.routes`, covering queue control, prompt submission, file upload and viewing, node metadata, system inspection, and job tracking."
    },
    {
      "title": "WebSocket",
      "path": "api/websocket.md",
      "nav_section": "API Reference",
      "audience": null,
      "evidence": "Source-backed from pinned snapshots",
      "summary": "ComfyUI uses `GET /ws` as the real-time channel for queue state, execution lifecycle messages, UI output updates, and preview images. The route is implemented with `aiohttp.WebSocketResponse` and is the main mechanism that keeps the frontend in sync while a prompt runs."
    },
    {
      "title": "Prompt Submission",
      "path": "api/prompt-submission.md",
      "nav_section": "API Reference",
      "audience": null,
      "evidence": "Source-backed from pinned snapshots",
      "summary": "`POST /prompt` is the main execution entrypoint. The handler accepts a workflow payload, validates it, assigns queue priority, extracts sensitive metadata, and enqueues the prompt for asynchronous execution."
    },
    {
      "title": "History and Queue",
      "path": "api/history-queue.md",
      "nav_section": "API Reference",
      "audience": null,
      "evidence": "Source-backed from pinned snapshots",
      "summary": "ComfyUI splits live scheduling state from completed execution records:"
    },
    {
      "title": "Client ID",
      "path": "api/client-id.md",
      "nav_section": "API Reference",
      "audience": null,
      "evidence": "Source-backed from pinned snapshots",
      "summary": "`client_id` is the identifier that ties HTTP prompt submission to the WebSocket client that should receive execution updates. It is not the same thing as a prompt ID. A prompt ID identifies one queued workflow, while `client_id` identifies the frontend session that should receive targeted lifecycle events for that run."
    },
    {
      "title": "Hooks Section Guide",
      "path": "hooks/index.md",
      "nav_section": "Hooks / Hooks Section Guide",
      "audience": null,
      "evidence": "Operational guidance",
      "summary": "This hub routes readers through ComfyUI hook surfaces. Start here when you know you need extension points but have not yet narrowed the layer."
    },
    {
      "title": "JavaScript Hooks",
      "path": "hooks/javascript-hooks.md",
      "nav_section": "Hooks",
      "audience": null,
      "evidence": "Official docs-backed from docs.comfy.org",
      "summary": "ComfyUI's JavaScript extension system calls named hooks on every registered frontend extension by routing through `invokeExtensions()` or `invokeExtensionsAsync()`. These hooks are the main supported way to modify client-side behavior without directly rewriting core UI code."
    },
    {
      "title": "Server Hooks",
      "path": "hooks/server-hooks.md",
      "nav_section": "Hooks",
      "audience": null,
      "evidence": "Source-backed from pinned snapshots",
      "summary": "The current ComfyUI server exposes a small number of meaningful server-side hook surfaces directly in Python. The most explicit one is the prompt preprocessing hook chain stored in `self.on_prompt_handlers`. Execution also exposes progress and lifecycle messaging through the executor and WebSocket path, which is the main observability surface for server-side integrations."
    },
    {
      "title": "Extension Points",
      "path": "hooks/extension-points.md",
      "nav_section": "Hooks",
      "audience": null,
      "evidence": "Official docs-backed from docs.comfy.org; Source-backed from pinned snapshots",
      "summary": "ComfyUI extension work splits across a few distinct surfaces rather than one universal plugin API. In practice, you choose between frontend hooks, server-hook callbacks, custom routes, and custom nodes depending on what you are trying to change."
    },
    {
      "title": "Custom Nodes Section Guide",
      "path": "custom-nodes/index.md",
      "nav_section": "Custom Nodes / Custom Nodes Section Guide",